{
  "schema": "andoc.document.v1",
  "documentId": "anx-sample",
  "revision": 0,
  "title": "ANX Sample",
  "locale": "en-US",
  "createdAt": "2026-07-19T16:00:00.000Z",
  "updatedAt": "2026-07-19T16:00:00.000Z",
  "metadata": {
    "author": "ANX",
    "purpose": "format-validation-example"
  },
  "assets": {},
  "blocks": [
    {
      "id": "heading-1",
      "type": "heading",
      "level": 1,
      "content": [{ "text": "Human view and agent structure" }],
      "provenance": { "kind": "human", "capturedAt": "2026-07-19T16:00:00.000Z" }
    },
    {
      "id": "paragraph-1",
      "type": "paragraph",
      "content": [
        { "text": "One canonical document drives both views. ", "marks": ["bold"] },
        { "text": "Edits are transactions against stable node IDs." }
      ]
    },
    {
      "id": "table-1",
      "type": "table",
      "caption": [{ "text": "Machine-readable table" }],
      "rows": [
        [
          { "id": "cell-surface-header", "header": true, "content": [{ "text": "Surface" }] },
          { "id": "cell-source-header", "header": true, "content": [{ "text": "Source" }] }
        ],
        [
          { "id": "cell-human", "content": [{ "text": "Human" }] },
          { "id": "cell-human-source", "content": [{ "text": "Rendered from document.json" }] }
        ],
        [
          { "id": "cell-agent", "content": [{ "text": "Agent" }] },
          { "id": "cell-agent-source", "content": [{ "text": "Structured blocks and transactions" }] }
        ]
      ]
    },
    {
      "id": "chart-1",
      "type": "chart",
      "alt": "Two equal bars representing human and agent access",
      "spec": {
        "$schema": "https://vega.github.io/schema/vega-lite/v5.json",
        "mark": "bar",
        "data": {
          "values": [
            { "surface": "human", "score": 1 },
            { "surface": "agent", "score": 1 }
          ]
        },
        "encoding": {
          "x": { "field": "surface", "type": "nominal" },
          "y": { "field": "score", "type": "quantitative" }
        }
      }
    }
  ]
}
